{"$schema":"https://json-schema.org/draft/2020-12/schema","$id":"provan.session10_reviewer_receipt.v1","type":"object","required":["schema_id","reviewer_role","verdict","open_p0_count","open_p1_count","open_p2_count","reviewed_commit","reviewed_tree","reviewed_pre_review_root","findings","claim_dispositions","model_identity_limitation"],"properties":{"schema_id":{"const":"provan.session10_reviewer_receipt.v1"},"reviewer_role":{"enum":["IMPLEMENTATION_AND_SAFETY","PROOFS_CLAIMS_AND_HANDOFF"]},"verdict":{"enum":["GO","NO_GO"]},"open_p0_count":{"type":"integer","minimum":0},"open_p1_count":{"type":"integer","minimum":0},"open_p2_count":{"type":"integer","minimum":0},"reviewed_commit":{"pattern":"^[0-9a-f]{40}$"},"reviewed_tree":{"pattern":"^[0-9a-f]{40}$"},"reviewed_pre_review_root":{"pattern":"^sha256:[0-9a-f]{64}$"},"findings":{"type":"array","items":{"type":"object","required":["severity","code","summary"],"properties":{"severity":{"enum":["P0","P1","P2"]},"code":{"type":"string","minLength":1},"summary":{"type":"string","minLength":1}},"additionalProperties":true}},"claim_dispositions":{"type":"array","minItems":71,"items":{"type":"object","required":["claim_id","disposition"],"properties":{"claim_id":{"pattern":"^G10-[0-9]{2,}$"},"disposition":{"enum":["ACCEPTED","REJECTED"]}},"additionalProperties":false}},"model_identity_limitation":{"type":"string","minLength":1}},"additionalProperties":false}
