{"claim_dispositions":[{"claim_id":"G10-01","disposition":"ACCEPTED"},{"claim_id":"G10-02","disposition":"ACCEPTED"},{"claim_id":"G10-03","disposition":"ACCEPTED"},{"claim_id":"G10-04","disposition":"ACCEPTED"},{"claim_id":"G10-05","disposition":"ACCEPTED"},{"claim_id":"G10-06","disposition":"ACCEPTED"},{"claim_id":"G10-07","disposition":"ACCEPTED"},{"claim_id":"G10-08","disposition":"ACCEPTED"},{"claim_id":"G10-09","disposition":"ACCEPTED"},{"claim_id":"G10-10","disposition":"ACCEPTED"},{"claim_id":"G10-11","disposition":"ACCEPTED"},{"claim_id":"G10-12","disposition":"ACCEPTED"},{"claim_id":"G10-13","disposition":"ACCEPTED"},{"claim_id":"G10-14","disposition":"ACCEPTED"},{"claim_id":"G10-15","disposition":"ACCEPTED"},{"claim_id":"G10-16","disposition":"ACCEPTED"},{"claim_id":"G10-17","disposition":"ACCEPTED"},{"claim_id":"G10-18","disposition":"ACCEPTED"},{"claim_id":"G10-19","disposition":"ACCEPTED"},{"claim_id":"G10-20","disposition":"ACCEPTED"},{"claim_id":"G10-21","disposition":"ACCEPTED"},{"claim_id":"G10-22","disposition":"ACCEPTED"},{"claim_id":"G10-23","disposition":"ACCEPTED"},{"claim_id":"G10-24","disposition":"ACCEPTED"},{"claim_id":"G10-25","disposition":"ACCEPTED"},{"claim_id":"G10-26","disposition":"ACCEPTED"},{"claim_id":"G10-27","disposition":"ACCEPTED"},{"claim_id":"G10-28","disposition":"ACCEPTED"},{"claim_id":"G10-29","disposition":"ACCEPTED"},{"claim_id":"G10-30","disposition":"ACCEPTED"},{"claim_id":"G10-31","disposition":"ACCEPTED"},{"claim_id":"G10-32","disposition":"ACCEPTED"},{"claim_id":"G10-33","disposition":"ACCEPTED"},{"claim_id":"G10-34","disposition":"ACCEPTED"},{"claim_id":"G10-35","disposition":"ACCEPTED"},{"claim_id":"G10-36","disposition":"ACCEPTED"},{"claim_id":"G10-37","disposition":"ACCEPTED"},{"claim_id":"G10-38","disposition":"ACCEPTED"},{"claim_id":"G10-39","disposition":"ACCEPTED"},{"claim_id":"G10-40","disposition":"ACCEPTED"},{"claim_id":"G10-41","disposition":"ACCEPTED"},{"claim_id":"G10-42","disposition":"ACCEPTED"},{"claim_id":"G10-43","disposition":"ACCEPTED"},{"claim_id":"G10-44","disposition":"ACCEPTED"},{"claim_id":"G10-45","disposition":"ACCEPTED"},{"claim_id":"G10-46","disposition":"ACCEPTED"},{"claim_id":"G10-47","disposition":"ACCEPTED"},{"claim_id":"G10-48","disposition":"ACCEPTED"},{"claim_id":"G10-49","disposition":"ACCEPTED"},{"claim_id":"G10-50","disposition":"ACCEPTED"},{"claim_id":"G10-51","disposition":"ACCEPTED"},{"claim_id":"G10-52","disposition":"ACCEPTED"},{"claim_id":"G10-53","disposition":"ACCEPTED"},{"claim_id":"G10-54","disposition":"ACCEPTED"},{"claim_id":"G10-55","disposition":"ACCEPTED"},{"claim_id":"G10-56","disposition":"ACCEPTED"},{"claim_id":"G10-57","disposition":"ACCEPTED"},{"claim_id":"G10-58","disposition":"ACCEPTED"},{"claim_id":"G10-59","disposition":"ACCEPTED"},{"claim_id":"G10-60","disposition":"ACCEPTED"},{"claim_id":"G10-61","disposition":"ACCEPTED"},{"claim_id":"G10-62","disposition":"ACCEPTED"},{"claim_id":"G10-63","disposition":"ACCEPTED"},{"claim_id":"G10-64","disposition":"ACCEPTED"},{"claim_id":"G10-65","disposition":"ACCEPTED"},{"claim_id":"G10-66","disposition":"ACCEPTED"},{"claim_id":"G10-67","disposition":"ACCEPTED"},{"claim_id":"G10-68","disposition":"ACCEPTED"},{"claim_id":"G10-69","disposition":"ACCEPTED"},{"claim_id":"G10-70","disposition":"ACCEPTED"},{"claim_id":"G10-71","disposition":"ACCEPTED"}],"findings":[],"model_identity_limitation":"fresh read-only Codex reviewer process; the application exposes no cryptographically attestable underlying model-build identifier or signed reviewer-runtime identity. Reviewer explicitly accepts the typed runtime-proof-envelope schema-valid/Python-invalid non-applicability recorded in the reviewed crosswalk.","open_p0_count":0,"open_p1_count":0,"open_p2_count":0,"reviewed_commit":"5cc8f201867d27aa88f82502dfac69c20ff9d3ac","reviewed_pre_review_root":"sha256:27cf0d90b04a9a5abad934ccb9e839d25deaf13554b4bff8f2515624581a3821","reviewed_tree":"a4baf548671b2a2eb45116b360cd760227b053d2","reviewer_role":"PROOFS_CLAIMS_AND_HANDOFF","schema_id":"provan.session10_reviewer_receipt.v1","verdict":"GO"}
